{"$schema":"https://json-schema.org/draft/2020-12/schema","additionalProperties":false,"description":"Closed structural schema for injected patch evidence. Semantic and hash checks are enforced by dpslab.patch_evidence.","properties":{"assertions":{"items":{"type":"object"},"type":"array"},"identity":{"type":"object"},"integrity":{"type":"object"},"schema_version":{"const":"0.1"},"source":{"type":"object"}},"required":["schema_version","identity","source","assertions","integrity"],"title":"DpsLab patch evidence record 0.1","type":"object"}
