{"assertions":[{"assertion_id":"synthetic-damage-change","certainty":"exact","citation_token":"section.synthetic.1","invalidation_families":[],"new_token":"synthetic-coefficient-b","old_token":"synthetic-coefficient-a","operation":"change","parameter_family_id":"synthetic.role.damage","subject_tokens":["class.synthetic","spec.synthetic"]}],"identity":{"created_at":"2026-07-31T12:02:00Z","evidence_id":"synthetic.patch.120500.1","lifecycle":"current"},"integrity":{"evidence_sha256":"758e833e0fefdcc291e505e051113bf1a0ba58008498a11a0ae3ad6494cac44b","hash_algorithm":"sha256"},"schema_version":"0.1","source":{"acquisition_class":"manual","authenticity_class":"human_attested","build_max":120500,"build_min":120500,"captured_at":"2026-07-31T12:01:00Z","content_sha256":"aaaaaaaaaaaaaaaaaaaaaaaaaaaaaaaaaaaaaaaaaaaaaaaaaaaaaaaaaaaaaaaa","interface_max":120500,"interface_min":120500,"license_class":"first_party_reference","media_type":"structured_patch_note","published_at":"2026-07-31T12:00:00Z","source_family":"synthetic.patch.notes","source_owner":"synthetic.publisher","source_revision":"synthetic-r1","supersedes_evidence_id":null,"wow_product":"retail"}}
